{
  "$schema": "../brainrot_schema_v666.json",
  "id": "RIZZ-666-GOD",
  "type": "video",
  "platform": "universal",
  "content": {
    "title": "Rizz level: TRANSCENDENT",
    "description": "The rizz is so powerful it breaks the simulation. Viewer discretion advised.",
    "hooks": [
      "Rizz god incoming",
      "Your screen is about to glitch",
      "This is peak fiction"
    ],
    "hashtags": [
      "#rizz",
      "#rizzgod",
      "#brainrot",
      "#cursed",
      "#viral",
      "#fyp",
      "#skibidi",
      "#sigma"
    ],
    "thumbnail_prompt": "Abstract representation of pure rizz energy, golden aura, reality-breaking视觉效果, cursed emoji fusion"
  },
  "metadata": {
    "brainrot_level": 666,
    "created_at": "2026-03-31T03:33:33Z",
    "author": "RizzMaster666",
    "department": "meme_mutation_lab",
    "virality": {
      "predicted_views": 999999,
      "predicted_shares": 99999,
      "normie_seethe_level": 10,
      "guest_666_approval": true
    },
    "mutation": {
      "parent_strain": "RIZZ-333-BETA",
      "mutation_count": 66,
      "mutation_type": "fusion"
    },
    "shadow_ban_risk": "guaranteed",
    "tags": ["rizz", "transcendent", "cursed", "viral", "fusion"]
  }
}
